{
  "$schema": "https://json-schema.org/draft/2020-12/schema",
  "$id": "https://form997.github.io/Vong-co/data/v3_2/schema.json",
  "title": "HAI ĐẤT V3.2 — Source-grounded phrase locator index",
  "description": "Metadata-only index for two reviewed source systems: 32 labels LT-32-4 and 40 labels PC-40-8; zero performance approvals; not a license for score/audio reuse.",
  "type": "object",
  "additionalProperties": false,
  "required": [
    "schema_version",
    "started_on",
    "research_scope",
    "performance_status",
    "rights_status",
    "reader_notice",
    "items"
  ],
  "properties": {
    "schema_version": {
      "const": "3.2.0-alpha.1"
    },
    "started_on": {
      "const": "2026-10-28"
    },
    "research_scope": {
      "const": "source_label_index_only"
    },
    "performance_status": {
      "const": "pending"
    },
    "rights_status": {
      "const": "unverified"
    },
    "reader_notice": {
      "type": "string",
      "minLength": 30,
      "pattern": "0/20"
    },
    "items": {
      "type": "array",
      "minItems": 2,
      "maxItems": 2,
      "items": {
        "$ref": "#/$defs/item"
      }
    }
  },
  "$defs": {
    "phrase": {
      "type": "object",
      "additionalProperties": false,
      "required": [
        "number",
        "section",
        "source_music_locator",
        "source_lyric_locator",
        "printed_music_page",
        "printed_lyric_page",
        "ending_token",
        "pair_index",
        "source_note"
      ],
      "properties": {
        "number": {
          "type": "integer",
          "minimum": 1,
          "maximum": 40
        },
        "section": {
          "enum": [
            "I",
            "II",
            "III",
            "IV"
          ]
        },
        "source_music_locator": {
          "type": "string",
          "minLength": 10
        },
        "source_lyric_locator": {
          "type": "string",
          "minLength": 10
        },
        "printed_music_page": {
          "type": [
            "integer",
            "null"
          ],
          "minimum": 1
        },
        "printed_lyric_page": {
          "type": [
            "integer",
            "null"
          ],
          "minimum": 1
        },
        "ending_token": {
          "type": [
            "string",
            "null"
          ],
          "maxLength": 20
        },
        "pair_index": {
          "type": [
            "integer",
            "null"
          ],
          "minimum": 1,
          "maximum": 20
        },
        "source_note": {
          "type": [
            "string",
            "null"
          ],
          "maxLength": 500
        }
      }
    },
    "section": {
      "type": "object",
      "additionalProperties": false,
      "required": [
        "label",
        "start",
        "end"
      ],
      "properties": {
        "label": {
          "enum": [
            "I",
            "II",
            "III",
            "IV"
          ]
        },
        "start": {
          "type": "integer",
          "minimum": 1,
          "maximum": 40
        },
        "end": {
          "type": "integer",
          "minimum": 1,
          "maximum": 40
        }
      }
    },
    "item": {
      "type": "object",
      "additionalProperties": false,
      "required": [
        "piece_id",
        "slug",
        "title",
        "variant_id",
        "phrase_count",
        "beats_per_phrase",
        "source_register",
        "source_url",
        "source_description",
        "sections",
        "phrases"
      ],
      "properties": {
        "piece_id": {
          "enum": [
            1,
            20
          ]
        },
        "slug": {
          "type": "string",
          "pattern": "^[0-9]{2}-[a-z0-9-]+$"
        },
        "title": {
          "type": "string",
          "minLength": 3
        },
        "variant_id": {
          "enum": [
            "LT-32-4",
            "PC-40-8"
          ]
        },
        "phrase_count": {
          "enum": [
            32,
            40
          ]
        },
        "beats_per_phrase": {
          "enum": [
            4,
            8
          ]
        },
        "source_register": {
          "type": "string",
          "pattern": "^ban-to/[0-9]{2}-[a-z0-9-]+/v2-ra-soat-[0-9]+-cau\\.md$"
        },
        "source_url": {
          "type": "string",
          "format": "uri",
          "pattern": "^https://"
        },
        "source_description": {
          "type": "string",
          "minLength": 40
        },
        "sections": {
          "type": "array",
          "minItems": 3,
          "maxItems": 4,
          "items": {
            "$ref": "#/$defs/section"
          }
        },
        "phrases": {
          "type": "array",
          "minItems": 32,
          "maxItems": 40,
          "items": {
            "$ref": "#/$defs/phrase"
          }
        }
      }
    }
  }
}
