{
  "schema_version": "3.2.0-alpha.1",
  "started_on": "2026-10-28",
  "research_scope": "source_label_index_only",
  "performance_status": "pending",
  "rights_status": "unverified",
  "reader_notice": "Chỉ là chỉ mục nhãn câu theo nguồn V2: không có tổng phổ, bản ca hoặc nhịp/song lang đã thẩm định. 20/20 hồ sơ mở, 0/20 bài nghiệm thu diễn xướng.",
  "items": [
    {
      "piece_id": 1,
      "slug": "01-luu-thuy-truong",
      "title": "Lưu Thủy Trường",
      "variant_id": "LT-32-4",
      "phrase_count": 32,
      "beats_per_phrase": 4,
      "source_register": "ban-to/01-luu-thuy-truong/v2-ra-soat-32-cau.md",
      "source_url": "https://nhacsivandan.wordpress.com/2013/08/18/bai-luu-thuy-truong/",
      "source_description": "Văn Dần công bố bản chữ nhạc 32 câu nhịp tư; nhãn lời số tương ứng. Không dùng hệ 16/32 câu nhịp tám để lấp.",
      "sections": [
        {
          "label": "I",
          "start": 1,
          "end": 8
        },
        {
          "label": "II",
          "start": 9,
          "end": 16
        },
        {
          "label": "III",
          "start": 17,
          "end": 24
        },
        {
          "label": "IV",
          "start": 25,
          "end": 32
        }
      ],
      "phrases": [
        {
          "number": 1,
          "section": "I",
          "source_music_locator": "Bảng V2: nhãn nhạc câu 01",
          "source_lyric_locator": "Bảng V2: nhãn lời câu 01",
          "printed_music_page": null,
          "printed_lyric_page": null,
          "ending_token": "HO",
          "pair_index": null,
          "source_note": null
        },
        {
          "number": 2,
          "section": "I",
          "source_music_locator": "Bảng V2: nhãn nhạc câu 02",
          "source_lyric_locator": "Bảng V2: nhãn lời câu 02",
          "printed_music_page": null,
          "printed_lyric_page": null,
          "ending_token": "XANG",
          "pair_index": null,
          "source_note": null
        },
        {
          "number": 3,
          "section": "I",
          "source_music_locator": "Bảng V2: nhãn nhạc câu 03",
          "source_lyric_locator": "Bảng V2: nhãn lời câu 03",
          "printed_music_page": null,
          "printed_lyric_page": null,
          "ending_token": "HÒ",
          "pair_index": null,
          "source_note": null
        },
        {
          "number": 4,
          "section": "I",
          "source_music_locator": "Bảng V2: nhãn nhạc câu 04",
          "source_lyric_locator": "Bảng V2: nhãn lời câu 04",
          "printed_music_page": null,
          "printed_lyric_page": null,
          "ending_token": "XANG",
          "pair_index": null,
          "source_note": null
        },
        {
          "number": 5,
          "section": "I",
          "source_music_locator": "Bảng V2: nhãn nhạc câu 05",
          "source_lyric_locator": "Bảng V2: nhãn lời câu 05",
          "printed_music_page": null,
          "printed_lyric_page": null,
          "ending_token": "XỰ",
          "pair_index": null,
          "source_note": "mô-típ trùng 5↔7"
        },
        {
          "number": 6,
          "section": "I",
          "source_music_locator": "Bảng V2: nhãn nhạc câu 06",
          "source_lyric_locator": "Bảng V2: nhãn lời câu 06",
          "printed_music_page": null,
          "printed_lyric_page": null,
          "ending_token": "XANG",
          "pair_index": null,
          "source_note": null
        },
        {
          "number": 7,
          "section": "I",
          "source_music_locator": "Bảng V2: nhãn nhạc câu 07",
          "source_lyric_locator": "Bảng V2: nhãn lời câu 07",
          "printed_music_page": null,
          "printed_lyric_page": null,
          "ending_token": "XỰ",
          "pair_index": null,
          "source_note": "mô-típ trùng 5↔7"
        },
        {
          "number": 8,
          "section": "I",
          "source_music_locator": "Bảng V2: nhãn nhạc câu 08",
          "source_lyric_locator": "Bảng V2: nhãn lời câu 08",
          "printed_music_page": null,
          "printed_lyric_page": null,
          "ending_token": "CỘNG",
          "pair_index": null,
          "source_note": "cụm lời “Đai cân” cần đối chứng"
        },
        {
          "number": 9,
          "section": "II",
          "source_music_locator": "Bảng V2: nhãn nhạc câu 09",
          "source_lyric_locator": "Bảng V2: nhãn lời câu 09",
          "printed_music_page": null,
          "printed_lyric_page": null,
          "ending_token": "CỘNG",
          "pair_index": null,
          "source_note": null
        },
        {
          "number": 10,
          "section": "II",
          "source_music_locator": "Bảng V2: nhãn nhạc câu 10",
          "source_lyric_locator": "Bảng V2: nhãn lời câu 10",
          "printed_music_page": null,
          "printed_lyric_page": null,
          "ending_token": "XỰ",
          "pair_index": null,
          "source_note": null
        },
        {
          "number": 11,
          "section": "II",
          "source_music_locator": "Bảng V2: nhãn nhạc câu 11",
          "source_lyric_locator": "Bảng V2: nhãn lời câu 11",
          "printed_music_page": null,
          "printed_lyric_page": null,
          "ending_token": "XÊ",
          "pair_index": null,
          "source_note": null
        },
        {
          "number": 12,
          "section": "II",
          "source_music_locator": "Bảng V2: nhãn nhạc câu 12",
          "source_lyric_locator": "Bảng V2: nhãn lời câu 12",
          "printed_music_page": null,
          "printed_lyric_page": null,
          "ending_token": "LIU",
          "pair_index": null,
          "source_note": null
        },
        {
          "number": 13,
          "section": "II",
          "source_music_locator": "Bảng V2: nhãn nhạc câu 13",
          "source_lyric_locator": "Bảng V2: nhãn lời câu 13",
          "printed_music_page": null,
          "printed_lyric_page": null,
          "ending_token": "CỘNG",
          "pair_index": null,
          "source_note": "mô-típ trùng 13↔17↔21"
        },
        {
          "number": 14,
          "section": "II",
          "source_music_locator": "Bảng V2: nhãn nhạc câu 14",
          "source_lyric_locator": "Bảng V2: nhãn lời câu 14",
          "printed_music_page": null,
          "printed_lyric_page": null,
          "ending_token": "U",
          "pair_index": null,
          "source_note": null
        },
        {
          "number": 15,
          "section": "II",
          "source_music_locator": "Bảng V2: nhãn nhạc câu 15",
          "source_lyric_locator": "Bảng V2: nhãn lời câu 15",
          "printed_music_page": null,
          "printed_lyric_page": null,
          "ending_token": "U",
          "pair_index": null,
          "source_note": "lời ghi dấu “(U)” — cần giải nghĩa ca/ngân"
        },
        {
          "number": 16,
          "section": "II",
          "source_music_locator": "Bảng V2: nhãn nhạc câu 16",
          "source_lyric_locator": "Bảng V2: nhãn lời câu 16",
          "printed_music_page": null,
          "printed_lyric_page": null,
          "ending_token": "LIU",
          "pair_index": null,
          "source_note": null
        },
        {
          "number": 17,
          "section": "III",
          "source_music_locator": "Bảng V2: nhãn nhạc câu 17",
          "source_lyric_locator": "Bảng V2: nhãn lời câu 17",
          "printed_music_page": null,
          "printed_lyric_page": null,
          "ending_token": "CỘNG",
          "pair_index": null,
          "source_note": "mô-típ trùng 13↔17↔21"
        },
        {
          "number": 18,
          "section": "III",
          "source_music_locator": "Bảng V2: nhãn nhạc câu 18",
          "source_lyric_locator": "Bảng V2: nhãn lời câu 18",
          "printed_music_page": null,
          "printed_lyric_page": null,
          "ending_token": "XÊ",
          "pair_index": null,
          "source_note": "mô-típ trùng 18↔22"
        },
        {
          "number": 19,
          "section": "III",
          "source_music_locator": "Bảng V2: nhãn nhạc câu 19",
          "source_lyric_locator": "Bảng V2: nhãn lời câu 19",
          "printed_music_page": null,
          "printed_lyric_page": null,
          "ending_token": "XÊ",
          "pair_index": null,
          "source_note": null
        },
        {
          "number": 20,
          "section": "III",
          "source_music_locator": "Bảng V2: nhãn nhạc câu 20",
          "source_lyric_locator": "Bảng V2: nhãn lời câu 20",
          "printed_music_page": null,
          "printed_lyric_page": null,
          "ending_token": "LIU",
          "pair_index": null,
          "source_note": null
        },
        {
          "number": 21,
          "section": "III",
          "source_music_locator": "Bảng V2: nhãn nhạc câu 21",
          "source_lyric_locator": "Bảng V2: nhãn lời câu 21",
          "printed_music_page": null,
          "printed_lyric_page": null,
          "ending_token": "CỘNG",
          "pair_index": null,
          "source_note": "mô-típ trùng 13↔17↔21"
        },
        {
          "number": 22,
          "section": "III",
          "source_music_locator": "Bảng V2: nhãn nhạc câu 22",
          "source_lyric_locator": "Bảng V2: nhãn lời câu 22",
          "printed_music_page": null,
          "printed_lyric_page": null,
          "ending_token": "XÊ",
          "pair_index": null,
          "source_note": "mô-típ trùng 18↔22; chữ “tạn” cần đối chiếu"
        },
        {
          "number": 23,
          "section": "III",
          "source_music_locator": "Bảng V2: nhãn nhạc câu 23",
          "source_lyric_locator": "Bảng V2: nhãn lời câu 23",
          "printed_music_page": null,
          "printed_lyric_page": null,
          "ending_token": "LIU",
          "pair_index": null,
          "source_note": null
        },
        {
          "number": 24,
          "section": "III",
          "source_music_locator": "Bảng V2: nhãn nhạc câu 24",